{
  "schema_version": "0.1.0",
  "generated_at": "2026-01-10T12:00:00Z",
  "components": [
    {
      "path": "components/bbhai-review-sample/component_manifest.yaml",
      "manifest": {
        "schema_version": "0.1.0",
        "name": "bbhai-review-sample",
        "version": "0.1.0",
        "capabilities": [
          "review"
        ],
        "schemas": {
          "target_profile": ">=0.2.0",
          "test_case": ">=0.1.0",
          "finding": ">=0.1.0"
        },
        "description": "Sample stub component for registry validation.",
        "repository": "local",
        "license": "Apache-2.0",
        "contact": "support@ravdevops.com"
      },
      "errors": [],
      "enabled": true
    }
  ],
  "notes": [
    "Component registry is informational only.",
    "Schema validation requires the jsonschema package."
  ]
}
